,clean_tweet_final,label
16244,if you are pa of the 64.2 mil who rejected his business. &amp; must be stoppea|,1
13899,you might be a libtard if...,1
9873,it's not the job of those who are disadvantaged by white privilege to calmly educate white people aboua|,1
20085,so had the right idea in how to deal with her,1
28186,only a like could merge images like this without understanding the racist impact of the effect.,1
31045,book - enduring conviction: fred korematsu &amp; his quest for hta|,1
20263,you go girl!!,1
6486,did you vote for this animal america: no fat chicks,1
3920,obstruction goes all the way back to when he discovered was black,1
30731,"thereas no such thing as an average christian, or muslim, or jew. a| a|",1
27875,"'the by its very dna, is a largely-unrepentant affair that has no business existing'",1
14621,riyadh is renowned for some of the deadliest traffic in the world. a|,1
25515,but can vomit a monster truckload of shit about the and they don't jail him for ? pigs,1
10273,"and being a ww, i feel culpable 4 deeply entrenched systemic that exists so i do all i can to dismantle",1
25494,"iave had my id checked by the police zero times in 8 months. of course the discrepancy has ""nothing"" to do i'm a wha|",1
24245,jokes about women penis humping girl,1
20277,video shows white texas cop arresting black mother who repoed assault on her son,1
21940,ag pick jeff sessions scrubs racism from record...even tho he once argued this is a felony,1
771,great aicle. right on the money!,1
558,i don't like the slogan. talk about being .,1
20746,"""the reality is that the tech industry is made of regular-ass people.""",1
16467,"nope, still struggling to see either or in that observation.",1
15790,share 6 steps you can take to stop a racist attack or intervene with a berating bully via,1
22272,you're running out of bitches to you d(c)d(c)d(c) d(c)d(c)d(c),1
19912,"jews, christians and muslims all believe that good will prevail.",1
12830,in my previous job every person's response to was doing the &amp; that's including &amp; mgta|,1
15362,in injustice and inflame protests over ash: tya|,1
14816,"&amp; joseon people in japan, will abuse the for claims of own rights by rough demo.",1
2968,why is 4 whores on ring of fire ?,1
10319,scary that it's not that long ago!,1
6574,d own team up with &amp; show what &amp; combat,1
12133,.@user &lt;--- no more feeding at the public trough piggy.,1
20219,"could it be that is impossible? real acts of racism is easier to stand up to ...unfounately, youa|",1
21368,the latest the seattle daily! thanks to,1
25545,travelled for game sad and disappointed of fans the sad i can't cheer for my own team .,1
30074,"in bluntly language, here announces racial profiling at main station.",1
405,when you're blocked by a troll because you promise to &amp; let his nonsensical rants boosa|,1
804,keep up the opposition to,1
1079,"the fn is seeking to rid of its anti-semitic, xenophobic image, but majority of its sympathisers still describe thea|",1
8747,d! publishing industry tell-all! d! just $3.99!,1
7276,"white people got nothing to do with this nigga. it's just one sick, horrible person, sadly all youa|",1
28921,your comments are reflections of ignorance and,1
9967,"in the news: from racism to resource development, here are the political stories inuit watched in 2016a|",1
22366,boob marathi nude women,1
21256,who pulled his chain?? you sob!,1
6803,"whining ""women have it so much harder than men, cause .""",1
20464,delta is under fire after youtube prankster is removed from a flight for speaking arabic,1
17635,black dad puts baby mama on blast after he takes their biracial daughter to get braids,1
27257,what about black tea?,1
25638,"still needs help. thinks he's survived. we need to get him out of office, asap.",1
18111,aowhy is it illegal to show photos of women but legal to write comments?,1
7003,if i ever met him i would drop that pos right where he stood! is nothing but a,1
9638,council staff have been instructed by the anc to go slow and make the da look bad. this was exposed a few weeks ago.,1
17705,the term jihad is a highly-contested concept. a|,1
23198,word factory: race denial prevents healing! &gt;9,1
22397,"when a can run you the risk of looking unintentionally . :/ moredun, edinburgh",1
30793,a drunk lady falls on a heater in &amp; an my indian friend is trying to help but he is being thrown out.,1
17423,a peek of here: then come back to holier than moi??,1
28386,milo yiannopoulos.is a hate mongering . i'll never buy another book from nazi ss and tossing any i have in the bin,1
9401,sea shepherd suppoers are racist!,1
29819,obstruction goes all the way back to when he discovered was black,1
26853,"btw, fuck blm and fuck that bitch which is real . any simpleton can figure that one out.",1
14813,american taxpayers have also lost their homes by the millions a| a|,1
18549,"arc 5 week on &amp; mon 6:30 pm, $70 sliding scale.",1
5582,"i despise . in that hatred of racism, it causes me, and many other black people ina|",1
31946,omfg i'm offended! i'm a mailbox and i'm proud!,1
6672,i've had 9.5 years of mostly &amp; even '#drs'... just leave me to die!,1
29169,"my age, gender or race should not define my capabilities in 2016.",1
4574,"here's a ?for the day the government and states county's etc. can smoking, ceain words , in schools ...so ?",1
10624,the cowboys racist. i'm convince fooh. my nigga got 12 wins and y'all gon swap him for the white boy who ain't did shit.,1
5102,"you don't think w will share guarani aquifer water w those who humiliated little brother,",1
8598,in chief- the gangs all here more at,1
111,i'm not interested in a that doesn't address &amp; . racism is about bringsa|,1
17453,msg of for a business to end .,1
10149,sea shepherd suppoers are racist!,1
19626,trump campaign official wants michelle obama to be alet loosea to live with african apes,1
29204,girls in the world jgirl sex,1
23963,if you are pa of the 64.2 mil who rejected his business. &amp; must be stoppea|,1
14893,"""vandals turned a jewish family's menorah into a swastika""",1
26670,it is truly sad. a who lot of working class men resent being offered help by a woman. evolution still has a lot ofa|,1
4055,"india willoughbyas entitlement is socialized, not innate sick of revoltingly entitled tws opia|",1
9160,"is this a new one? either way, disgraced themselves.",1
26077,has complained that the pap is to white according to their lawa|,1
18109,why is ignored,1
25931,"josephjett ""i do not advocate a kumbaya world. like should motivate us to a single purpose: intellectual competa|",1
4952,"2016 was the year white liberals realized how unjust, , and sexist america is",1
13237,"in the age of information, the true ethnicity of biblical people has caused an overlap of anda|",1
8735,vandalised in in condemns act,1
18435,here is some metrics for ya cowboy now stop nonsensa|,1
29678,ever noticed the word to a non black person and the word to a black person yields almost the same reaction?,1
3146,"we have to do this. need to change profiling, and get service to the poor.a|",1
18875,"based on recent commercials from state farm and old navy, omarosa's choice is clearly .",1
1939,i agree that wouldnat have won the w/o much in same way wouldnat win w/o the a|,1
18785,here's a collection of our coverage of women-related issues,1
4819,allies r unstoppable! via,1
20322,i repeat: very concept of ( to only talk about ea|,1
6043,if you truly stand for equality then none of these can be acceptable. a|,1
16414,ag pick jeff sessions scrubs racism from record...even tho he once argued this is a felony,1
14082,are you &amp; feel like the are a|on you? listen,1
7722,yoyas market in deming nm did not sell beer to me because i'm white they said they were closed then a hispanic walked in n they sold,1
15924,nothing would be more dangerous than to give the impression we accept,1
19220,itas up to us as consumers to hold the media accountable,1
8247,"as a student in 89/90 in a bar i stood next to a white man who said ""i don't do pakis""",1
26846,"the latest ""say what?!?!"" thanks to",1
1382,just because you are self-loathing doesn't mean the rest of us are. the only weapon you have is to yella|,1
1241,"although, i am not a , a or a so i hope that i still qualify.",1
7215,you might be a libtard if...,1
13132,1/2 we're told over &amp; over that laws are need to &amp; realia|,1
6167,sea shepherd suppoers are racist!,1
16666,cutsie logic but wrong. if you know construction you can build bridges and walls! give trump a chance! hate is fora|,1
31407,buffalo school board moves to oust controversial ally for remarks,1
31196,for is in u.,1
31742,you might be a libtard if...,1
24792,brutality rules new year on manus close,1
22687,smiling has a positive effect on racist and first impressions -,1
29463,this diagram explains trump's response to orlando,1
11393,and you will hear kurds are free and equal citizens. like state's mouthpiece 'journo' claimed.a|,1
17408,uk 2016 expressed as a photo,1
13863,"hey guys, apparently white and black people are even for that whole slavery thing, so that's nice.",1
31637,you might be a libtard if...,1
15572,"is , and for the job.",1
11611,trump ally wishes mad cow disease death for obama,1
5445,in atlanta the mayor &amp; police force allow s to rule the city block roads &amp; freeways w/o action,1
18245,wow in are worried bout and moving in if that was reversed it would be called,1
4616,chaplin - the dictator speech via,1
7283,"more propaganda from - this time videos on ""how to properly stab a jew""",1
4855,black professor makes assumptions about an entire race whilst speaking for entire race. next week the jews!,1
10021,oops! i did it again! melted another fragile snowflake! heed,1
22335,"joy to the world, instead of and",1
24458,you might be a libtard if...,1
7043,"so, no one, no one, in line said anything... silence is complicity in racism. speak up pea|",1
5019,bout to spend new year's eve playing the game lol,1
7062,i can't believe that they don't show blazing saddles on tv any more just because the lead actor is a black man... that's,1
23426,against whites damon sajnani teaches some really lame classes.,1
30242,i'm always amazed at the number of excellent black athletes that want to play at racist schools in racist states.,1
31912,i couldn't end without mentioning,1
25435,"please repo this guy, openly racist and reprehensible",1
13288,and you will hear kurds are free and equal citizens. like state's mouthpiece 'journo' claimed.a|,1
20628,porn videos free nude beach photo,1
15329,"you're defending a woman against ""condescension"", who was in turn defending a woman that was verbally assailed in fa|",1
19385,white girl has sex with black guy best world sex,1
31667,the need to keep feeding their,1
11577,we need more aicles like this from on positive narratives against .,1
544,that doesn't prevent you from being a and a,1
31765,what has todayAs attitude to women got in common with that of norman bates?,1
29087,after being a of a (i was called a cr*cker) i now truly what it feels like to bea|,1
16446,has happened far too often,1
12845,"it's 2016! would you question like that considering her age, condition &amp; facta|",1
26580,2:30pmet: uk youth parliament on &amp; . listen on our free app:,1
5849,"a$?i,come here velly a$?i,",0
28826,comes out in 14 minutes and im taking my science final instead of getting the lipstick...,0
14540,"""postitnotechronicles"", that's what they want to complain about!",0
18685,excellent news with work.,0
8978,be n i don't believe in accidents. there are only encounters in history. there are no accidents. a pablo picasso twtly.a|,0
28185,father's day and spending the morning writing a parser.,0
25590,i am thankful for getting encouragement.,0
6651,keyring make shop at xx,0
24606,the bad pa about summer is my jamba juice smoothies always melt quickly,0
8751,our first ultrasound scan tomorrow! can't wait! 7 weeks 5 days today! :),0
11424,"childrens day kids of all ages a$?i,",0
27734,goodnight everyone!,0
24862,happy wheels a comic level! a allow's play...,0
7200,what i thought was real ... was not ...it was aal,0
3102,how long will be the delay??i might miss an impoant briefing bcoz my flight keep being retimed,0
25092,"great mood! manchester, united kingdom",0
6394,"itas been said that life is 10 percent what happens to you, and 90 percent how you react to it!",0
1518,3 massive games today 4 day weekend anyone? v 2pm v 5pm v 8pm,0
31488,a re-takes 5-dma post-ez data,0
3367,"good news !!! aoo 3/4 ,do 3/4",0
14771,coral graveyard: the aftermath of bleaching on the great barrier reef a in pictures,0
7909,i am lovely.#i_am,0
2294,"bihday to you hope you have a wonderful day. happy we are only 5 months apa lol. have a great day. da$?i,dSSd>>",0
20937,i love u take with u all the time in urd+-!!! dddd d|d|d|,0
17006,i bought a kaleidoscope at an estate sale for $1 yesterday. :) a|,0
20335,had the best peach pancakes and hash browns at with !,0
3515,"whatever makes you feel good, keep it.",0
8958,i am thankful for smiles.,0
9300,well they kind of work.. snapseed stopped working within the editing..,0
376,do what you love to do simply for the love of it.,0
11464,i'm staing my natural journey today ddd i'm getting really great news,0
7907,today is a beautiful day!,0
26028,we wish youth member a great time at today. the trip was nearly over before it staed!,0
26041,i'll be watching the stream!! ddd,0
9045,161|366 flying free. i,0
29425,these look a little forge pond park,0
4293,bye bye it was a pleasure!,0
31582,sweet pie baby ... gbp 19.00 get here:,0
10120,you're for a reason you made fav for hubby even when not on menu today,0
3827,has gone through many troubles with censorship. they have faced many cuts. so it equalises to as well.,0
5684,"i've come 2 the conclusion that many people simply don't understand democracy, what it is and what it means &amp; represents",0
604,loving frm the bottom of my hea frm the day it stared.. &amp; what do v get in return..,0
3971,happy 1st anniversary hina di ddaPSda$?dddon twitter blessed day fr all hinaholicsd$? usd#lovelovelove,0
7164,good morning everyone dddSS,0
30734,"oh yeah i found the perfect bihday cake for ddd bihdaylivmorgan a$?i,",0
20227,v hard indeed to feel hopeful for our kids today,0
981,touch my tits -,0
16642,"buy things about ""flag day 2016"": a|",0
13700,introduction to happy days,0
24227,"d kayak, pinery, grand bend strip + beach adventure with katie d perfect weather and such a fun day",0
16744,love u just want a burger right about now :(,0
31454,after sex watch best porn movies,0
29100,and the press would have you believe bike racing is too dangerous? thoughts go out to the victims in orlando dY=,0
30893,"niggas know they took us from our homeland and denounced our ways as savagery..n we still some jesus praising, name brand dependent ppl",0
4901,i've decided to be !,0
14157,i am respected.,0
13402,a place for everything and everything in its place! thats professional organising with,0
10866,it's sad at how many drunk people there are at they are missing a great show and they'll never remember it!,0
21049,"comes new two sons too many story like they but ,",0
4614,"keep your to keep smiling, always!",0
13272,interview next week friday.,0
30435,"when people speak of you, it should bring a smile to their face.",0
14309,denim pet jacket gbp 16.00 get here:,0
21683,come on in for our new hour! try our amazing 4 for $4 treats!,0
8038,that moment you try your new lippies &amp; it sucks.,0
2769,it is a true,0
13054,looking to feel more join me and 20 speakers on the free summit,0
9135,amazing showers again for the 3rd evening in a row. someone is happy up there. this madras girl is,0
25490,results and clients everyday d go check out ash_tag_makeup for some beautya|,0
25297,yay we hit 100 followers today! thank you all.,0
16404,unreal. knew it would only be a matter of time. working on this story for,0
5336,ok that's nasty,0
16643,"usa plays stupid asf dod,dod, come on play better",0
20941,one more day to go ... first swimming lesson,0
17797,"in today's episode of dahaq we saw all shades of a$?i, d",0
24104,watching last nights &amp; i can so relate to what is saying about huge ego making others feel insecure etc!,0
18198,received my order of bars and am so ! i've been eating these for a couple years anda|,0
22497,happy sunday! sunday,0
15941,my golf is in for it's 1st service. i'm able to walk home for the first time since my knee replacement,0
15581,attack bull chase: when you leave the lot despite the fact that you're a strong source,0
30648,thanks the film plans are hotting up ! your &amp; andrew's hard work is coming together xx,0
9559,...#ourleadersaresleeping ... ... pls retweet until it gets to smwhere.. thankyou,0
7295,is officially a working girl again!,0
25437,i thought you were happy but you turn me out~,0
7499,"grimace photo sessionaoi,dd a|",0
17405,just my new venture a for,0
174,everyone is everything,0
10471,i guess his friends are more impoant than his girlfriend. d,0
20945,"i'm in awh every time i look at my daughter, because she is just the cutest baby i've ever seen and she's minedd",0
9579,i love u take with u all the time in urd+-!!! dddd d|d|d|,0
28455,*even lost motivation to caption this* (vine by queen depressed,0
492,hi teddy corpuz... ddddddd,0
26233,direction to see the new,0
17754,shadows d>>d,0
14614,"enjoyd#chocolate,dbea""oA2breakthroughA(r) ,d'#cancera""freed#bodyda#beautya 1/4 i,dod,",0
21429,dealing with same thing but ipod and ipad versus play station.,0
25059,tweeters! have a fabulous d,0
29859,5 night time mistakes that will keep ... |,0
4380,think positively,0
2272,happy friday angels !!,0
30199,"polar bear climb racing: angry polar bear climb racing, the polar bear living in cold places lookin",0
10111,retweet if you're ! xo,0
29165,i am sparkling.,0
3413,my beautiful bobo! love her! thea|,0
14916,fans didn't follow me back,0
4695,last night is the best hahahahah,0
13510,some girls make finstas to post slutty pics they can't post on ig,0
9552,"makes me dd""dd st. moritz (ch)",0
3009,all packed to despatch our first order to newzealand !! the oceans,0
9273,bull up: you will dominate your bull and you will direct it whatever you want it to do. when,0
896,the secret of a happy marriage is all about finding other people less attractive: and those who repo...,0
7880,to the in my d,0
4168,"bahahaha, this is so me right now! ddd'd1",0
16153,danother great local tweet in share yours on jivemap:,0
886,outlining my themes for my would-be poems haha,0
29502,very to listen to give a talk on for,0
30653,now or never -,0
23515,when you've been waiting all night to hangout and they cancel because other people are apparently better than you,0
20253,"count down has officially begun, 2 weeks til houston d$?d 1/2",0
13460,bubbles!,0
1016,"what? nice parroting of ""racist"" talking points repoed last night.",0
20745,"we could build a future where people are free to live and love the happiest time, our time""",0
16777,today's yummy was with and cheese,0
16290,"hey, &lt;== have a tuesday ==&gt;",0
12732,father's day!,0
20108,"for fuck's sake, orlando.",0
17876,relaxing nature sounds,0
18557,hi!! i am nickol,0
25686,let's vote for i$? at 1/4 {06-05-2016} happy bihday byunbaek~~~,0
862,buffalo simulation: buffalo for you to take in the vicinity of their homes to do. in this wa,0
17486,sometimes life is too hard to be alone and sometimes its too good to be alone.,0
5817,they're ready!!! galaxy cinemas orillia,0
18656,"well, i wasn't planning on cutting but the points changes might make it an easy sacrifice for the new house plans!",0
12393,anever ever apologise for anything that makes you a,0
43,my mom shares the same bihday as bihday snake! see you this weekend dd 1/4,0
18160,how to my who is with,0
26059,happy friday everyonedd,0
27269,9941 are people team saruman or team frodo swaggins ?,0
18777,not all control battles are loud and . they can be soft and too: via,0
17888,sometimes it only takes a blanket,0
11808,johnny depp is no longer remotely hot and queer dance clubs are mass killing grounds,0
11583,i'm so sorry. . to us all,0
10746,looks sooo good,0
8334,happy fathersday !,0
125,las vegas strip,0
6598,"i just thought ""fuck yeah! oranges!""",0
21946,floating on frozen treats,0
12643,don't sweat the small stuff people. enjoy and live your life!,0
4042,mehn what a big lost! delta is lose two heros! keshi and kosoko wife!,0
17479,new year sex sleeping girls fucking pic,0
3342,loser and another loser...i know her endorsement will put you over the top! lucky you!,0
21887,"honey, i got nothing to lose.. &lt;3",0
4604,1. mass shooting 2. discuss 1-5 weeks 3. do nothing 4. unto newer topics..,0
2632,todays festival outfit,0
14992,"to bae, our kids just wished me ""father's day"" :')",0
30513,welcome super 2 wrk w u !! ha|,0
10290,"we'll be heabroken we'll pray we'll vent, beg &amp; plead &amp; again, nothing will happen. because nothing ever happens",0
24253,"if not being told to stand down by obama admin islamophiles, maybe they just don't have good judgment.....",0
17281,fathers day to all the dads in tue world,0
15757,why do we only see the worst in people?,0
30006,molly is still after dPd,0
19042,one of secrets to be happy in consumerist society? - just want enough not more,0
13004,another beautiful creature loses its life for doing what a wild animal does :(,0
11485,u.s. nationala|,0
4641,barrel bag gbp 19.00 get here:,0
929,bride: a woman with a fine prospect of happiness behind her. aambrose bierce,0
14826,a few changes to 4 from the beta-reader &amp; we totally nailed the outline of book 2. now.,0
305,enjoying these delicious melons!,0
31683,as relevant as ever,0
26048,two things to make you in life - and lemon,0
24556,my .. on what makes me .. da$?ddddd,0
26889,attack bull game 3d: do you really think that his head was empty around the city. each side is,0
16746,"break .... it... good evening everyone.... goa, camsur",0
18017,what's happening to this world we're living in?,0
19174,ty so much for the lovely rose,0
1825,let's take off on a to the lets know more ona|,0
8816,harrods ......,0
3649,in 10 mins!!!,0
8235,"parents of toddler who drowned in neighbor's pool charged with murder neglect, not murder...",0
23523,where is your place???,0
13557,u gotta expect disloyal shit no matter how loyal you are,0
19827,the greatest team we ever had are leaving us one after the other,0
5435,"welfare mom, shop lifter &amp; mouthpiece must be the most self-loathing woman of color, ever.",0
3961,praying for orlando and for all the families involved ....,0
10025,your actions are what make you happy,0
19414,"another day, another mass shooting here in america. what happened to tolerance and respect for those with other opinions and values.",0
31133,what that he's a celebrated shyster or the fact that these ever proliferating stories only galvanize his constituents? /true,0
15442,enjoy starring cuba gooding jr ! &gt;&gt;&gt; !,0
14880,[1465729992.1] update,0
4858,it's hello kitty friday!! d have a fabulous day xoxo,0
14091,the fosters coming back 6/20/2016 just a day and a half left,0
206,can't wait for,0
23493,the face i pull after a long days work when i get that first toke,0
31756,flor ...the in the ......xoxo flor .... el...,0
24053,i am thankful for comfo.,0
17996,"yeeesss!!! the euros is about to sta!! a 1/2 i,",0
5655,another mass shooting &amp; killing of innocent people in the so . day 55 ofa|,0
16692,1 more day to be 21 me edda,0
28581,"-puppy special day, special ...",0
9446,ben is literally one of the most fake human beings i have ever encountered dddd,0
12172,"ive just repurposed this former mustard jar into a beaut little vase dd,d,",0
19439,today was a great day... first ever neckie,0
28816,so sad that a fellow from my has been taken from us. are with his,0
334,gorilla simulator: you need to do to adapt to the environment. the need to tear the city. material,0
15422,set of 6 glass ... gbp 24.99 get here:,0
13003,lucky to get a table tonight! i know i am on for a treat!,0
5895,dad and lad! kanecrookes_04 dd 1/2,0
20957,brutality of a husband on his wife in open public who belongs to a so called peaceful religion.,0
5209,when u realized is going to a conce with you this saturday d+-dd 1/2 d,0
9606,bc the are about to be so lit.,0
26870,packing for move back east is nearly done. wife/kids have 24 hrs 'til plane takes 'em away from l.a. for good. i'll join 'em in a week.,0
23290,just until we sta just time for finishing touches.,0
25374,cobb apparels - italy fashion,0
8414,thalaivaa vijay bdayspl week,0
19723,so happy to be reunited with this gorgeous lady ddd,0
14533,have my lover stop being angry at me visit us..&gt;&gt;&gt;,0
26869,travel sunday with family a|,0
6196,dd$?d 1/4 you're so talented &amp; humble. tnx 4 being my friend even when i fa.,0
14233,"it's bad enough not being able to see braydon for weeks at a time, but staing tomorrow i can't even communicate with him for 3 days.",0
28012,"kind of happy, listening to my own song.",0
14306,"yo en pose!! stowe, vermont",0
12256,"it rains here a lot, but there's never any thunder, and it's one of the things i miss most from the mn. it just staed thundering.",0
5718,this cute fella wants a binq design dog feeder too :(,0
16359,my quotes:,0
19324,about to sta at the !,0
6128,you're a great talent but just an idiot on political and social issues.,0
12918,and looking forward to,0
26578,oh no!! it my asandande shezi bihday,0
12466,when bron was in south beach all you miami fans loved him and his crying but since he left y'all y'all wanna bash him smmfh,0
31932,thanks gemma,0
15543,be so happy that when others look at you at get are too.,0
27336,pig birds family \ rhymes lyric... via,0
6371,i am stunning.,0
18969,a strong top forming - scotiabank,0
9657,has a way of doing that,0
20086,/follow us a copy of clean and lean for life ...,0
