,clean_tweet_final,label
24676,but watching wendy so,0
3694,i need to book mine soon!,0
3519,whisky connoisseur kits,0
20898,i move in to my apament tomorrow.,0
17424,"this time next week, i'll be in floridaaaaaa! ddd",0
4148,who gets to be and why? (via,0
480,excited to be on the other side of the cuain for once tonight. looking forward to seeing on broadwaya|,0
28029,"dads are gifted, they lead the money game. so, that's why they always win.",0
19003,new music coming! hear a sneak peek now!!!,0
20216,damn ave smh 4 years ago,0
10124,can't wait till the movie comes out!! dd,0
24678,i love u take with u all the time in urd+-!!! dddd d|d|d|,0
17991,jim and james avolt on the right. 3 generations of jahn's on the left. father's day. beautiful morning.,0
26951,"when leaves, we are back in the clutches of &amp;",0
23838,today too happy bihday johnny!!,0
19868,"it takes a great deal of courage to stand up to your enemies, but even more to stand up to your friends. ~ j. k. rowling",0
3230,"red eyes, runny nose, headache. that's what you get for crying all morning mr. velicaria.",0
22454,i'm quite content with myself d,0
2477,i am fun.#i_am,0
26091,when in doubt - order right? especially on a !! dd,0
31435,"after an hour of walking and looking for something i could buy, i just ended up with these. d",0
14112,rooster simulation: i want to climb the vast expanse of mountains. it reached the leakage,0
31305,please like &amp; share if you are agree,0
1889,it's just been a bad week overall. every day matt and i heard of another death.,0
17535,yeah yeah yeah i hear ya,0
29499,"sono contento, i'm happy",0
5983,sheer waste of two hours watching this. too much noise over crap!,0
17325,got to see the allison boys today.,0
10541,".@user and yes, we daughters, too!",0
12624,"went out with friends last night. good music, food, but...wow, this is what the singles scene looks like now?",0
14655,we just want to wish you a from eastridge!,0
16860,the waiting game... which ship i'll be on next!! aaaaah i want to know now please! d,0
30129,the welsh in is what a tournament should be like! dd>>,0
3990,i woof my life! :-),0
16378,sign up! move the forward!,0
30847,last lecture was given. all my students passed! see you all next year!,0
26892,greek pasta salad recipe,0
24139,reminder: is on tonight ... missing chillicothe women..,0
30636,when your campers decide to work at camp!,0
18598,make connection - sho comics - sad little princess,0
31563,confirmed as one of our sponsors,0
6867,"way down. way, way down. (#chAste)",0
29742,how utterly pathetic. wish ali was around to beat this person senseless.,0
29248,my whole life.. ddd,0
16302,i miss the momentaY=,0
997,what a,0
19364,father's day to my wonderful daddy and to all the daddy's in the world.,0
29245,clap along if you feel like a room without a roof ddddddd because i'm happy!,0
7148,"yeah, she'll be elected right after jill stein. a million words to describe urself and you choose ""gamer"",",0
17988,hardcore anthems naked german sluts,0
24461,less than 1 month! our &amp; is getting close! ha|,0
24667,"that's a1i,",0
1281,come see brooklyn &amp; host the parade on sat. 6/25! htta|,0
14500,loving this product! get that white smile ready for summer! message for details d,0
30448,homemade coleslaw and chicken kiev a|,0
9294,a simmons to transition into a woman?,0
15514,that you can't see what's right in front of your face,0
31561,get those posts seen and make others happy! come join the nowlinkup via,0
31463,don't be afraid just keep grinding and believing in yourself.,0
1169,ahhhh in 2 days!,0
23274,praying for orlando and for all the families involved ....,0
5676,you can do a lot with an extra hour!,0
9111,not too sure if many people my age still countdown a bihday like me?! dd 3/4 dd,0
24445,"life is good, lap it up! day17",0
19528,pics of marbella making me miss it,0
13417,ellie's beauty box:,0
9318,daddy est. 1997 father's day,0
2891,at this,0
14769,logo we proudly present our new logo!d make my event ht ... - - - - l ...,0
632,"happy father's day a 1/4 i,a$?i, daya|",0
25989,happy friday...,0
16046,do u even know how that watchlist is created?...ur viewing the issues on a very superficial level,0
4233,stuck in the rat race? find your freedom.,0
6125,"till june 15, 11 am - 7 pm",0
28456,"wakeuppeopl3: duck motherfucker! misinformation, conspiracy",0
5333,"when your dreams are bigger than your fears, you've gotta get excited!",0
369,back to the day job for shane lowry!,0
19066,.#smiling it forward d,0
28559,getting fat d a|,0
18388,oh how amazing were the days when instead of the likes of coldplay we had the likes of travis,0
26295,bull up: you will dominate your bull and you will direct it whatever you want it to do. when y,0
17337,we don't need to blame all atrocities on or - there are nuts everywhere who commit,0
4002,i wasted so much money on food this year...it ain't even funny.,0
3568,can schools be places? find out with and i,0
10243,blows my mind. but i think my mind is all out blown at this point! 5 mos and then just destruction.,0
5316,threats from terrorists are becoming real,0
13835,literally had the best week ever. chilling in sun and spending a week my my one before new beginnings on mondaydd<<,0
25067,"father's day! to all living &amp; passed, we love you dearly! thank you for your love always.",0
665,gorilla simulator: you need to do to adapt to the environment. the need to tear the city. m,0
30586,so annoyed i didn't get this hoodie from when i tried it on and now i can't find any xs anywhere,0
23640,i am charming.,0
24706,the time is finally here !!! dd-d>>,0
12663,were the first person i wanted to run to when i was but you are the of my ness and i will no longer anymore.,0
23825,come on england ...,0
18361,come on jo!! we had a massive box for a camp! loads of codes! will see if we still have them!,0
10606,haroldfriday what exciting activities are you up to this weekend? have fun! hta|,0
26969,well we didn't have the luxury of playing mexico. we've at least done it once. you've never done it. ever.,0
31284,sushi time! dPS,0
5569,fathers days to all the men who try their best to be there everyday and not just todaya|,0
17076,on behalf of i am soooo to be san diego's best dance crew at thea|,0
345,happy father's day 2016 to my dad and all of the dad's out there!!,0
3192,"happy father's day to all the superhero dads! d""d>>dad 1/4",0
1092,freedom day wehoddd,0
28786,day#with all contract#central london#galton flowers#,0
5421,"here's ruben &amp; bounty, the 2 ex-racehorses who were recently rehome from our centre, out on a trail ride! d",0
22537,some ppl care about winning at any cost &amp; we'll ray is that kind,0
24428,reached the sad news of anton yelchin's death. it's unfair!,0
9284,"until the usa gets it's gun laws under control nothing will change, and the last people they will listen to are us gays",0
8979,"public education, kids are just products on an conveyor belt, finished product is young adult w/ no idea how world works",0
18051,16 ways makes you happier (#infographic),0
2448,i will be voting for you in the primary.@user is a disgrace and needs to be removed.his trump hate is insane.,0
7966,i guess he's gonna persist with this anti irish vitriol.,0
22541,"and thats why nba will forever be behind soccer, football, baseball, and hockey. actually behind boxing toood$?d",0
11772,"good morning london. off to regent, bond &amp; oxford today :):):)",0
17606,tune in to at 8pm tonight for a huge announcement xx,0
27340,holiday nails ready d d>>,0
22877,one year to go until i marry the beautiful,0
3363,...wonder if we will sign some speed and creativity for the offensive midfield positions for the next season.,0
19464,just me ad me alone nw,0
11390,and now we've got,0
27095,my in the,0
12187,singer at,0
5705,"my dear, be slow to become angry.",0
21978,i've done the daily contract twice and the weekly contract as well and have received no cryptokeys. must be compensated now!,0
23089,on the train to wembley to watch,0
5772,"there's so much more to talk about regarding but i just can't tweet about it all. could be a good year for gaming, though.",0
19446,more progress done on this drawing d,0
15664,these are just stunning statistics!!! why such an increase under obama?,0
3329,truth telling:what makes sanjay dutt happy?,0
18375,just as well i skipped pub time in dublin,0
31271,there's just something about that makes us feel and .,0
7627,i'll place the stars as the world falls down it's falling down it's a repulsive little chap. d!,0
20247,weddings are impoant because they celebrate life and possibility. aanne hathaway,0
23979,breen and steward little broke up after steward little was a poop and broke her hea,0
16211,new to tweet quite fr the app :-),0
23943,so proud of the jma poster session prize!!! thank you,0
4654,just caught up with my golly gosh d| never seen something so beautifully done! literally broke my hea d,0
2733,i'm a dj! lol!!! a,0
10098,"now playing : masaji watanabe - "" in the garden after the rain"" on music song",0
8134,i have my first day of work tomorrow!!!! yay,0
22966,be n war would end if the dead could return. a stanley baldwin,0
5007,50 americans were murdered by a terrorist &amp; people on social media are more worried about calling out politicians/arguing.,0
13212,happy bihday too meeeeeee!! bday bdaytome,0
8692,kaaen in the pocket!,0
23189,now i can send dej all my cute selfies &amp; nudies all day long,0
25813,"missing you comes in waves, today i'm drowning...",0
15978,"this will decide the election. it did for obama. harpo is oprah backwards, and her llc or whatever.",0
1952,your is helping educate we love their faces.,0
5924,saturday night,0
11500,see you this christmas hahahhaha,0
350,wishing this guy a !! blaze says is the spitting image of aa|,0
2654,first major spos championship win in 52 years,0
19530,i am thankful for films.,0
25657,aaawwwww so cute,0
8508,check it out! premium nutrition,0
30675,my jogging along the waterfront dd>>dad>>d adorable! ddd,0
6286,is in dayton tonight and i couldn't get a babysitter. :(,0
10724,5hrs to go - best get your place in the queue at bill graham. enjoy get ready to,0
20938,and i so love monday! :d,0
21108,mp &amp; kiev-1 commander says deny deaths of volunteers out of disrespect to fallen fighters:,0
3194,can help with or is !!,0
8633,gift for proud dads.available for 1 day,0
21335,can't belive the hockey season is over....,0
19816,stuck for gifts this this gift set could be a perfect gift for your dad,0
30401,when clients bring you presents ddd ms moo make up,0
31450,"a little more adjustment &amp; finish the painting all over it be done. got a vision, create it xxdd",0
29665,the magic's in the music.,0
28337,hour with hubby at blend restaurant,0
1530,i love u take with u all the time in urd+-!!! dddd d|d|d|,0
17789,a| das ventil wars!,0
9293,why can't there be secular education in haredi life? it existed in 1940-50 brooklyn. why not now?,0
24433,"buffalo simulation: buffalo for you to take in the vicinity of their homes to do. in this way, you",0
23655,,0
6136,will be released on september 30th 2016!,0
2875,cavaliers league chosen one#game 5 and 6 decided by the officials,0
29178,"aladdin on the tv today on my bihday then aladdin in the theatre on thursday for my bihday aoi,dd d",0
6054,how to make an overweight dog,0
18249,"mass shooting at a nightclub 50 dead, 53 injured. seriously what is this world turning into? dY=dY=dY=",0
27891,that's it i will finally sta to plan my trip to europe.,0
15588,"i despise hilary and sadly, hearing her speak now i'm telling myself ""see trump, that's how a president is supposed to sound"".",0
26348,all linked up &amp;,0
15300,"first afternoon of a weekend in suffolk: barn owl, marsh orchids &amp; micro-moths galore... that'll do!",0
24537,coming soon to near you!,0
24781,"be joyful in hope, patient in affliction, faithful in prayer... a|",0
22804,vacation booked! anybody tried the finest playa mujeres reso in cancun?,0
27749,"so only 200 families were ""temporarily"" moved to diepsloot in 1995.now diepsloot has 800000 shacks &amp; still no proper houses?",0
5039,the massive spectacle that is is taking shape for tomorrow's opening.,0
3917,"i appreciate you, my dudes.",0
364,as as a tool for is !!,0
1187,i'm letting my piercer decide what my new piercing! so we'll find out friday what new addition i'm adding,0
30116,d?d happy sunday dd?,0
27216,very dissatisfied with online let us rent at 10a. location message said noon customer rep now says not until 2pm,0
28361,"my today's : me: i want to wear my red bloody you want too much, xoxo",0
8681,my mommy grounded me from club penguin because i didn't go to bed before 9,0
15909,oh my god! finally after 2 months of waiting im watching yha episodic :d,0
21942,book your own visit at,0
9637,f**k feelings,0
11754,in other news: dave matthews band is at jiffy lube live and i'm in the middle of nowhere.,0
13666,"happy father's day!!! love you, dad!",0
23772,we went to the park. she had a run in paddled in the river!,0
4853,new trending gif on giphy,0
16163,"i miss la a$?i,",0
31629,"be n a life making mistakes is not only honourable, but more useful than a life spent doing nothing. a george bernard shaw a|",0
28893,now you see me 2 ddd,0
6562,gotta sta somewhere d$? german village,0
2981,i believe and trust these powerful words,0
17571,ty angie! beautiful pic weekend,0
3858,maraas secret / okinawa the secret is out,0
12355,"check us out on the web: join us sunday, june 19, 2016",0
13331,i just can't get enough. than you so much god! ddda$?,0
29572,"this orlando shooting is fishy to me. since when do police raid a place in 3 hours? 50 people seems like a lot dead, from one shooter.",0
592,"i've got news for you, bernie wasn't winning dc even if the vote was held last month.",0
19647,kill all shopping centre music,0
3778,i sta folding all these clothes up and after 2 minutes i be like ok break time ddd(c),0
12157,hereas hoping luck is on my side when you hear my brand new single 'boom + bust' tomorrow.,0
20613,"every food and perfect gift is from above, coming down from the father of thea|",0
19512,ready for and press conference to see the rest of you saffas later!,0
7269,cant wait to get back into the studio! days away from getting staed,0
27687,life is a series of decisions and choices and one hell of a great ride.,0
31684,tuck says mom might love this cover more than me,0
6515,yes! i don't know if you guys did something but it worked now! thanks!!,0
8220,my warrior in my paper a$?d',0
16115,"good morning new york!!! beside myself with excitement! in croton on hudson. the most beautiful house, with beautiful people!",0
16366,como se fosse um desenho. as if it were a drawing.,0
29036,d em so excited en i just can't hide it dP,0
13344,must accept role in making of conspiracy to defame,0
13782,good night!!,0
154,and she will do just that....then what..business as usual.,0
9640,angry squeaking frog video:,0
16484,on tuesday me &amp; billy are heading up to london to attend a talk with john simm!,0
8429,my youth is yours &gt;,0
11452,go.. goooo...!! with d,0
11402,able to catch the last show on broadway!,0
31918,what the hell is wrong with humanity? why would anyone need to do anything to prove his faith?#ridiculous,0
22518,i am angelic.,0
1105,is my,0
1258,bitchezzzz season 4 is here a|,0
12534,phewww now time for conference ... project presentation. .. n ... d3d3d3d3,0
7906,ranveer's parents are in delhi at the ceremony.,0
23457,: the body of a 2-year-old boy snatched by an alligator at has been found.,0
23306,those venture capitalists put money above everything,0
13716,25 science backed ways to feel happier!,0
14197,front page should state former marine doesn't know the difference between 2 completely different rifles.,0
19013,d$? kellys spos bar,0
22277,care without carbon:,0
8539,"d green bay, wisconsin",0
4323,"i just got one of your sketchbooks for my roomie as a surprise gift, she's a huge fan too! d",0
23461,we just live our dreams... d,0
18076,weekend montana,0
12504,a muslim friend of mine told me if his young son ever came out as gay he would never speak to him again,0
25951,it wouldn't be a skyf1 show without a segment dedicated to lewis hamilton!!!,0
7353,"my hair is the blondest it's ever been and i'm so happy, love it!",0
12329,gazal follow,0
590,competing for a listing today!,0
22823,lived$?,0
28882,no filters needed. times. sean ogs gaoth dobhair,0
22668,funday!! dd>>d,0
13587,i am courageous.,0
8823,"im so excited to be behind the camera, directing, writing, producing again.. the quality is better than ever!",0
13060,the hashtag. lol,0
11444,knocked out friday. just have to knock out saturday then baby and i leave the states!,0
16162,"anaaa418 , you are absolutely correct - if you are , d you don't have toa|",0
3737,an epic adventure awaits today - 24 hours - relay - can we make it from london to cardiff?,0
1318,// it's 250 days on happy today .,0
6439,roger is back !,0
1527,i am thankful for honest conversations.,0
20001,if we could get on the bus we would leave the car at home never can get on the bus,0
17640,dPdPdP baby gee,0
4471,life is too sho to want to escape it -,0
8597,"had a good visit today a$?i,dPd 3/4 fathers day you",0
57,"happy fatheras day, mr. rayos",0
2460,happy face dddd aaaaaaaaaaaaa pic couessy: duddyabdurachim,0
23551,"improving everyday in the gym, even if its lifting 5kg more its an improvment and its keeping me happy.",0
21838,i love u take with u all the time in urd+-!!! dddd d|d|d|,0
24218,award winning chilli sauces dd,0
4382,"strongest one in the room, but the one with the thinnest skin.",0
28120,"whilst you're all waiting, get down to our haberdashery shop at hd1 3qw",0
24244,tomorrow is looking good for photo oppounities....watch this space,0
20900,fast and serious dC/ a|,0
11141,"kylo, don't let him get to you. come back.",0
21492,food diet benefits! - !!,0
17680,"please note that we will be closed tomorrow, we wish everyone a for tomorrow.#durban#music",0
18737,are we delicious? launch meeting about to commence!,0
12896,got hired at my first job,0
15288,nigth,0
11293,photoshoot time dd,0
8351,kyrie got all them handles but couldn't handle his chick kehlani..,0
923,aww yeah it's all good bing bong bing bong,0
24070,don't cry but smile,0
3566,wishing you a happy weekend and with this kind of attitude d d3,0
5256,now it's time to rest.,0
23076,i love u take with u all the time in urd+-!!! dddd d|d|d|,0
24793,i've now soed ~1/2 of my pictures from my trip in the us!,0
23294,next month can't wait for,0
6313,all my thoughts w/ lgbt community today. what a monstrous thing.,0
18798,"buffalo simulation: buffalo for you to take in the vicinity of their homes to do. in this way, you",0
27366,"in 4 weeks, i'll see these faces on a permanent basis!",0
6845,sweat it out... dadada is u know what to do...,0
8076,"jockey killed, two horses euthanized after incidents at indiana grand racing and casino hta|",0
26184,i'm over the moon. i love them so much ddddd,0
19245,waiting for my sis &amp; nephew to get here,0
21179,heas - 9 signs that he's and,0
16468,when facebook rules out '20% text rule'.,0
5041,"has c got his england kit on already? a 1/2 i,",0
1513,"seriously...slow it down, 2016. save some suckiness for future years. geez.#ripanton",0
22843,sunday compass,0
8270,people who do this should not be called parents...,0
22997,we are so for the 2nd annual bailey day taste off!! join us for,0
14810,finally got through season 1 of now onto season 2!!!,0
15021,he was too afraid to stand up to the nra,0
31225,ok so gerard way will be at comic con in noh carolina in november!!! and do you know where im not??? noh carolina!!,0
17554,montmare,0
23972,hmm - only fall for such things. you don't need it to be in &amp; ....,0
13226,6.19.2016 father's day d 3/4 dd 1/2,0
12263,two dramas sad news this weekend. paradise still hosts many angel ...,0
17253,getting spoilt or what? wishing all dads a ' &amp; fathersday,0
28738,choosing and editing pictures got me like d,0
21421,working on launching my first community. currently in the planning and seed development stage.,0
13133,up and ready to travel to for orientation!,0
26741,2b hardcore chapter 3 tiny junior high teen nude,0
17602,looking forward to compering this years park,0
19606,prayers to all victims and their families that were affected by the orlando shooting. violence must stop.,0
25970,home with incredible features:unwind over the weekend around the bonfire with your family &amp; friends,0
14455,morning run. nothing but open country ......and the occasional mobile mast,0
12567,when he sees he's crush talking to someone else d,0
4904,to speak with tomorrow at,0
13759,little,0
26631,"got my dad a spain fabregas jersey &amp; got myself thiago a$?i,",0
16068,many happy returns of the day! bihday jurgen klopp !!! happy,0
2153,rooster simulation: i want to climb the vast expanse of mountains. it reached the leakage cock w,0
30996,d'dd,0
1601,got my hamper today. thank you so much! to make it!,0
26731,a happy marriage is the union of two good forgivers. arobe quillen,0
25600,makes me so angry.,0
5319,problem with aol is its not available on mobile phones :( if u notice most users r using mails on mobiles.,0
20598,"why do i always feel so numb, empty and alone?",0
31235,"movie date da$?i,",0
25650,announces more office-bearers of zone,0
3380,i love u take with u all the time in urd+-!!! dddd d|d|d|,0
25903,when in your teamspeak channels are empty,0
1474,dd>>dd 1/2 dd?dd 1/4 ddd 1/4 d d 1/4 dd ddddd d#love#me#instagood#follow#photooftheday,0
18393,reading my manuscript and not wanting to stop. . good evening and good night. d',0
13531,i am thankful for apologies.,0
6685,"title for the next episode sounds epic, im sure its gonna be one helluva of a battle!",0
3828,"now playing : craig armstrong - "" hymn 3"" on music song",0
15620,"hey here's someone else who suppos you're lifestyle: also, happy father's day.",0
29655,happy^ at work conference: right mindset leads to culture-of-development organizations,0
16516,we want to wish every daddy a happy father's day !,0
20725,i am in the same situation.# change..but trying to feel good... thank you to rhonda and,0
17724,are you really ? invest in yourself at (link in bio).,0
31750,dark forest,0
5786,but i been asking for my shit since we was in school d,0
19035,with the kids so so,0
9383,i'm done picking the on,0
30424,one of the sad moment is when when i couldn't concentrate in my aayat had to close it,0
15261,white! ddd,0
8040,i just signed up on the ultimate tool,0
10097,attack bull chase: when you leave the lot despite the fact that you're a strong source o,0
3851,getting ready 2 lock horns with gullu butts of pmln. don't u know powerful in sohni dhei has no respect 4 law.,0
2274,first video coming tomorrow dd>>dd>> mark the date 17/06/2016,0
1228,so my manager invited to his wedding dd,0
7007,some are just and,0
2745,happy children's day to our paners &amp; kids around the world!,0
24690,lol and then there was this little jerk.... dd2,0
31067,"i can't believe how much i used to care what people thought of me now i'm just like ""lol fuck u, fuck you and wtf fuck you too, bye""",0
24340,i find it all a bit weird,0
19596,looks amazing. we shall definitely be by to give that a try too!,0
15190,"not acquainted with culture, trying to lure",0
9717,"her smile,my life",0
9941,,0
20329,i love u take with u all the time in urd+-!!! dddd d|d|d|,0
2843,"snow white --&gt; open! --&gt; , and or dm us today!",0
5663,cannot believe i have completed my occupational therapy course. looking forward to the next chapter!,0
14660,as as a tool for is !!,0
27792,someone trolling for attention.,0
12600,got my new car! so excited and happy!,0
1424,i am thankful for computers.,0
7955,"decades later, sickness among airmen after a hydrogen bomb accident - the new york times",0
16895,i've sadly have already punted on this season. it's apparent the fo doesn't want to win,0
29553,we are so to host benefiting the,0
21465,how to get balance in my life no4,0
15603,if only i knew how to sleep,0
27703,1/2 day left with students. yikes! retirement is getting real!,0
17480,don't gain the world and lose your soul.. wisdom is better than silver and gold!! ddd a|,0
10556,"first day shopping in absolutely ages a$?i,",0
25303,i'm a man... especially with added.,0
28191,"two friends d munich, germany",0
3654,spending this morning exfoliating and hydrating my skin with our,0
26140,my little bro may have just beat me in basketball,0
22276,it's so nice to come home and be caed to.... love my king,0
9110,"finally, after all this fucking heaache and bullshit it's all over, and now i can finally see your true colors. a",0
8555,why the more will the from,0
10019,early father's day fathers:) your appreciated!!!,0
23260,had a great time with handing out flyers for this conce.,0
14687,to get your vip tickets + tables to the 6th annual national reality tv awards . go here:,0
22862,met this |,0
20087,"retweet it sweetie da>>i,",0
23498,sunday remnants of a one person saturday night in richardson streeta|,0
8513,3 days to go!,0
31384,another girl there for APSAPSAPS,0
17769,if you got gators in your theme park why are they not completely secured away form the customer dC/d(c)d<<a|,0
23652,how many more have to die before we put an end to this shit!,0
24453,let's open the door to the weekend d!,0
15584,"whatever makes you feel bad, leave it. whatever makes you smile, keep it d,",0
18843,".@user featured my soon-to launch website, in its newsletter!",0
29960,these simple tips and advice can make you a and pic.twi.,0
7170,2 new dd 3/4 map.provincetown,0
5537,hello mahid!! hope you are doing good !! less than a day left to watch you playd!!,0
21815,back to life!,0
22333,"despite my prior worries, i am so grateful that my work lets me give back to my family. even a little bit.",0
1746,today is a perfect day to be !,0
