,clean_tweet_final,label
17016,this should have been enough 2 just say no a|,1
2796,"""the education of public servants is a critical pa of the path forward..."" so true.",1
3356,check out this post! confession: i'm,1
14506,"lisa likes cuckold write now! ai, aa",1
826,".@user is it possible for you to speak in any topic without bringing race into it, you bigot? a|",1
12894,amateur spanking vids against women in the workplace,1
20222,"in the case of the commonwealth of the internet vs the evidence proved him guilty of , , and",1
8352,! tears,1
13584,"omg, these trump suppoers are deplorable!",1
15469,the revolution occurredajust not how marx expected it to. a|,1
27212,"sad how people feel they have to treat others like scum just because of their religion, race, sexuality, ect.",1
11693,"is ? please stop this ""offended culture"" madness!",1
24623,go take your anti meds,1
16178,when you don't want to read dd 1/2,1
11320,the white flight of derek black,1
9976,you might be a libtard if...,1
3288,why is ignored,1
3864,trumps wall is not about . the coal fired electrical producers need to dispose of fly ash stockpiles.,1
30057,nude teen play for women in spo,1
1669,lying and his disingenuous excuses for remarks about michelle &amp;,1
30350,woman in cou on racism charge,1
7109,i'm not a but is the,1
16705,yup. i concur. as do nearly 3 million voters.,1
1409,"ultimately, a from early that i wish i didn't have to tell. i also wish it didn't do as well as it dida|",1
1709,hope to see you at the show,1
4054,nicola sturgeon sends her christmas message surrounded by white children. no brown kids for nationalist nicola.,1
2087,for hate crimes watch the in never seen so much hate against the poor like in thisdod>>d(c),1
1411,shot inside a pussy office woman,1
11271,"y'all, is global. we just may have to lose before folks understand.",1
9602,dear would you please ask these shameless givea|,1
18493,are a| &amp; feel like the are stomping on you? listen,1
19658,"ppl wait for 10 hrs airpo, miss connecting flights, put them on flights 24 hrs later, aa|",1
4914,"it was an error on my pa i agree. she was an exceptional performer, i was thrown off by an something inconsequena|",1
5053,you can go ahead &amp; change your profile pic. hepburn was an ambassador to unicef &amp; your ignorance would havea|,1
29048,"spread the word &amp; join millions for national day of healing jan. 17, 2017",1
13882,don't think it's awarded for or being being a self centred,1
30009,"oh yes! and this rude, nasty behavior brought out into main stream!",1
19732,homicides rose in most big cities this year - the wall street journal,1
12825,how did women fair in 2016?,1
17511,kicking off about acting slutty on do it every time and no one bats a lid. against men! ;),1
4262,says should with a -,1
31930,why is ignored,1
17844,neoliberalism prioritized money and oil over pretty much everything else. a| a|a|,1
28391,racist attack on three muslim women in city centre... for more info:,1
7824,you might be a libtard if...,1
13468,"so sick of all the pre-programmed rhetoric! enough, already!! how about unity, patriotism and love for fea|",1
28801,i live in nyc and don't see a lot of ove racism. i was disappointed to see how much there is on twitter. must never be tolerated!,1
22064,he's an unamerican .,1
6951,factophobia ale with people in 2017 who use following words:,1
7227,"here's how to combat violent extremism in 2017. ""the white nationalist who came to dinner""",1
156,"as the smaller hands show, barry probably lied about being why his game sucked more than his",1
20021,"you have no balls, lumpy. my girl was spot on. lumpy tony says i am a . prove it lumpy. bwahahahahaha",1
16522,why are white people when the rest of us are,1
30761,stop,1
1002,the latest the volatile daily! thanks to,1
22632,"- keep going stupids, keep commenting - already a! 30,- donations for sucksa|",1
24150,joe biden: 'i want to thank' trump for unmasking america's,1
30488,trump ny co-chair makes racist remarks about michelle obama,1
11595,"is restricted duty like a straght jacket and padded room? if not, we should look into that.#blacklivesmattera|",1
6353,don't let the skate on his true record of !,1
28530,is this the kind of tweet you want a company rep sending out?,1
30520,aren't protesting because a won-they do so because trump has fuhered &amp;a|,1
3663,"fo woh, texas, police chief: officer acted 'rude' but not racist in viral video",1
21592,this's insane acts by they will trample national flag of other nation. it's clearly .,1
8993,excellent! rambling about: the alt right (@user d,1
16933,you might be a libtard if...,1
19203,spos illustrated girls naked sex videos,1
12745,nothing. that would be .,1
3717,jeff sessions omits decades of records for his ag confirmation hearing you can't hide,1
22351,your copy of hot new swiftly sharpens the fang for just,1
26252,"""tackling systemic racism and our biases through empathy"" read:",1
313,7 horribly ads from that made us cringe,1
3506,speaking of in and ddd cc,1
25616,are you &amp; feel like the are a|on you? listen,1
746,used and to win the white house presses attack on khan family and g.o.p. leaders,1
5736,so deep need2know. if clintons r eating brown bread drinkdark milka|,1
25384,because you're a racist?,1
14064,seems its escaped your attention that bashing whites isn't winning you any elections - over 1200 dem seats lost 08-a|,1
27505,24hrs passed &amp; i'm still too angry about this d(c) to coherently talk about it.,1
22657,calls for to step down but he won't because he knows that he can spew with no consequences! d,1
6006,why is it forbidden to write '2 blacks' on a restaurant bill but ok to wear a t shi saying 'kill all whites'?,1
10223,will send you to the inauguration~ join today!!,1
4708,need to speak up against the that's rife within the community! it's unacceptablea|,1
29080,fo woh pastors say officer's acts in viral video arrests were racist,1
30022,"why? please explain to us why we're, ""bad.""",1
30080,: pupil suing school district after alleged classroom incident,1
24807,the latest the african american turmoil! thanks to,1
16001,vandalised in in condemns act,1
23644,the latest the blicqeraC/ daily! thanks to,1
27541,are you &amp; feel like the are stomping a| you? listen,1
21442,(advanced value chain videos at ),1
26697,nothing humorous about your jibes u trump official paladino under fire over crude obama remarks -,1
2635,is the dictionary word for anti-black,1
15885,"victim of adam saleh refers to black people as ""abeed"" (slaves) in one of his sketches.",1
916,aren't protesting because a won-they do so because trump has fuhered &amp;a|,1
26436,you might be a libtard if...,1
30444,billionaire chair of trump says he hopes obama dies and michelle goes back to being a male ape in africa.,1
24004,thought factory: left-right polarisation! ~14,1
18206,rise up today is out! stories of police brutality from,1
5685,trumpas odd nye tweet to aenemiesa 'the odd man out' self serving,1
13185,how can sainsburys have no red stripe?? ddd,1
1768,"abe government is mere puppet of ultra rightist group ""aeY=ae!a 1/4 edeg(japan conference)""",1
10833,.@user .@user .@user silence is approval. we always knew what pigs youa|,1
82,how the uses &amp; insecurity to lure men into,1
21485,so proud to have a mayor like who isnt afraid to speak the truth..and yes he is completely righta|,1
735,standing up to racism and hate by americad not curse out congress and all haters who are deplorable,1
4107,"you may have good intentions in saying ""i don't see color,"" but you're missing the point.",1
8073,"seriously lede. come on, you can do better.",1
3491,prison officers goaded inmates until they needed to be restrained as pa of a game,1
6379,thought factory: left-right polarisation! +8,1
4139,will the alt-right promote a new kind of racist genetics?,1
19292,you would believe the accusations regarding your father,1
30496,"judge lets wlk aftr the of a special needs blk teen. ddnt wnt tht on his record, would nevr work n reverse",1
11432,apologists be like ... doubletree by hilton londona|,1
8183,why is ignored,1
8757,saying i am not racist is not a| protest and denounce,1
733,"no, he was definitely a mexican.",1
5386,have the balls to it and expose me as a racist.,1
2522,are you &amp; a| like the are stomping on you? listen,1
26368,well said!,1
6048,to all those from ain't a in da blm,1
31606,i'm not i just hate those muzzies !,1
20423,you either call me eyetalian joke on my nationality or you're not,1
31739,my video on the whole situation,1
28316,because many of us find obama's policies repugnant does not make us you're liberal racecard has exhausted,1
14638,"white people, black people, brown people good &amp; evil is not a color!",1
17116,today 1000 s!,1
23394,: i can't wait nothing good of a (racist) and ( misogynist) than see to the women like animals.,1
15380,"""these are times of grave danger,with dissent recast as treason, unchained and intolerance on the march""&amp;ita|",1
21121,ambassador says is form of,1
3324,"when the market crashed in march 2000, greenspan cut interest rates even more a|a|",1
151,yes it's when you call a gorilla because racists have long thought of black people as no beta|,1
21550,"jews, christians and muslims all believe that good will prevail. cnn a|",1
10428,was a fighting &amp; in with her her her &amp; ha|,1
8530,directly applicable to trump.,1
21726,note: i was just able to pop this zit on my neck that's been there for days. i've beensqueezing it for days.a|,1
14699,farmer beaten during a land invasion crisis a loteni area via,1
31201,and d? racist#deathwish,1
9894,: ally carl slammed for wish list for what a cockwomble,1
5510,trump campaign official wants michelle obama to be alet loosea to live with african apes,1
2683,"trophy. i have always been one. by ""educate yourself,""",1
23050,this motherfucker needs to be in acharles paladino's racist comments spark calls for resignationa,1
3572,"icymi: ""why 2016 was not a complete washout for anti-racism"" by",1
114,why not mocked obama for being black.,1
15011,commercial showing inter-racial couple attacked by suppoers,1
31680,chick gets fucked crazy european sex,1
23662,are you &amp; feel like the are stomping a| you? listen,1
18079,aanti-islamista rally organiser shown laughing at death footage,1
15335,anyone has a right 2 question foreign parentage. mccain was questioned and accused by democrats.,1
15609,"aaall men are created equal,a and if we donat believe ita|maybe we should stop saying it!a - hube humphrey",1
9239,the historian whitewashing ukraineas past,1
24123,your comments are reflections of ignorance and . =,1
26005,all of them preying on poor,1
25019,michelle obama aape in heelsa case is just the beginning::,1
17621,"that's harsh, even in these post times. what next, a charity called send the bugga|",1
27542,trump new york co-chair makes racist 'gorilla' remark about michelle obama &lt; you total tool! fucking moron. hta|,1
24178,sea shepherd suppoers are racist!,1
3687,"police, check cashing industry, atlanta and profiling black men:",1
22046,. we must stand together with all of our brothers and sisters.,1
617,the latest obsidian radio daily! thanks to,1
15974,are you .. feel like the are stomping on you? listen,1
21658,save the date! 1-4-2017 sourcenation! live wed 8,1
24765,i've no problem with that teach against . but it's wrong to teach that all are !,1
31960,vandalised in in condemns act,1
26212,,1
3474,sea shepherd suppoers are racist!,1
21934,can't effo a logic point w/out or especially if that's wha|,1
2638,if i could this 1000x i wud.,1
987,"""no im not attracted to asian ppl bc im not asian"" what if i tell you no im not attracted to u bc im not (inse race here) hoe",1
13276,what if michelle obama had done this?,1
2898,the correct way it should have been written!!! doesn't matter her profession!!! is clearly still a thing!,1
29112,suspected henrico isn't ' - dec 31 9:46 pm et,1
7725,are you &amp; feel like a| are stomping on you? listen,1
30937,"you anti-whites brag about our ""inevitable brown future"" then scream """" when we oppose it. you're pushing",1
16668,the cold war was fought over oil. a|,1
31262,openly and total against graceless goodbye to america's first black president:,1
13681,"d it's there, it's dalthough i'm told that andrew jackson was and also",1
2750,has happened far too often,1
5903,sea shepherd suppoers are racist!,1
4712,nothing would be more dangerous than to give the impression we accept,1
30641,people around the world are afraid. the world is primed to react. a|,1
4140,word factory: race denial prevents healing! ~9,1
4305,"""black lives matter except for mine apparently"" have the patience 2 watch this all the way through",1
692,"carolyn cooper | ugly, poor, ignorant and black!",1
14381,i do d. my father had a great one and now my brother following him and yeah i married to this awesome gua|,1
13022,lame duck and lame dick,1
20092,in injustice and inflame protests over ash: tya|,1
27492,(advanced value chain videos at ),1
22780,in america: 'kill obama' and not welcome here' signs in new mexico draw criticism,1
30545,vandalised in in condemns act,1
31364,america isn't racist. their are a plethora of reasons for someone not to like obama. you're ignorant in many fashioa|,1
31318,perfect timing for this tweet!,1
15005,"if you get us into a war, you better send your boys uday &amp; qusay first! you're an idiot and a fool! sad!",1
11253,"white ""social justice warriors"" _ getting it wrong, again. via",1
21388,will the alt-right promote a new kind of genetics? mt,1
8639,university of wisconsin-madison won't cancel racially biased 'problem of whiteness' course,1
10477,"if you say the said that &amp; can be found with extremists of all faiths,a|",1
15466,you might be a libtard if...,1
11220,vandalised in in condemns act,1
29422,buffalo school districts boots trump ally over racist comments. :,1
425,why the nazis studied american race laws for inspiration a,1
22228,typical riding the machine sic.,1
26531,4 all 2 cou. no media coverage. or wp were victims and feared for their lives. maybe probation. who???,1
14231,fucking nude nerd girls naked,1
30372,"agreed.. the same is true for and .. they are overused terms, and as a result, are fast becoming meaningless.. d$?",1
13067,"anybody who says against men doesn't exist, hasn't tried to buy disney/looney toons-themed in men's sizes/cuts.",1
11243,are you &amp; feel like the are a|on you? listen,1
19406,"so sick of all the pre-programmed rhetoric! enough, already!! how about unity, patriotism and love for fea|",1
20323,fuck you you you may have fooled some but not the majority,1
18817,are you &amp; feel like a| are stomping on you? listen,1
25518,and his racism could fuel the power needed to light everyones christmas lights in the uk. a|,1
28352,"verified: shocking video of police touring civilians was shot at on nov 5, 2016.a|",1
13779,"leave a 'gweh' below a! if in 2017, you will no longer debate about ora|",1
6634,1.48 projection s,1
24902,sexism may be harmful to men's mental health...#men,1
25647,thought factory: left-right polarisation! +14,1
6207,so when is your next klan meeting?! my wife isn't white &amp; i'm proud of her &amp; our love. we are each others gift froma|,1
4129,the latest the african american turmoil! thanks to,1
7458,lock the gate!,1
11791,smoke out the old year and new year at the same time! marijuana unleashed at ibooks.,1
1136,how &amp; system fail to protect victims of police,1
27122,sex videos of chinese against women in the workplace,1
16803,we think of cultures as separate and distinct from one another. a| a|,1
29869,"good afternoon sweety! d send me letter ai,",1
29065,why is ignored,1
10736,(vine by 9/11 did bush),1
14965,"meet the wilmington peacekeepers, they walk in beauty. week of actions",1
10762,most likely the us is deploying bc we're and interfering with the within stop killing eaca|,1
17490,"this video was censored by youtube for ""hate speech"" d enjoy!",1
8795,"turns into a raging sexist, and genocide-defender.",1
9356,the idiocy of feminism. they actually think microaggressions matter. here's the proof:,1
622,just more overwhelming evidence that the company keeps echoes his sentiments &amp; ideals,1
16191,congressman hangs this picture nationas capitol. he should volunteer to be hua|,1
12206,not even trumpas transition team wants to deal with carl comments about the obamas - vanity fair,1
9813,and in a not so stunning response plan to nominate member to lead their pay.,1
16222,the problem is that thereas no space for alternative explanations.,1
26333,you might be a libtard if...,1
17749,hidden in is as rampant as blatant racism.,1
5091,"trump lackey carl palladino is th get of a mating betwn a pig &amp; a hyena &amp; iq of a slug. apologies to all pigs, hyea|",1
14350,", no? or perhaps paladino is feeling some ""economic anxiety""",1
24012,jeff sessions tries to delete decades of ....,1
31443,is a &amp; a sick fuck! he looks like his pedophile friend,1
23770,you might be a libtard if...,1
8416,on and but none against or or,1
19495,prolapsed pussy and women,1
8074,the truth about &amp;,1
19590,keep these conversations going at school and home. we need to create the space and time and commit to help them.a|,1
20161,why is ignored,1
19179,you see the driver &amp; i we're talking about africans who speak english fluently but this who just got on thoua|,1
6305,tell that jeffery beauregard to quit foolin' around and come pick up his hood &amp; sheets for saturdaa|,1
21284,fl woman screaming racial slurs aims gunas laser pointer at black mcdonaldas customer a|,1
6164,is okay,1
29304,"you forgot: small hands, orange skin, weird hair, big teeth",1
17823,are you &amp; feel like the are stomping on you? listen,1
13990,why is ignored,1
3249,"ultimately, a from early that i wish i didn't have to tell. i also wish it didn't do as well as it dida|",1
12110,because i've been paying attention for the past year/8 years. he's a a|,1
23055,the radicalism of woodrow wilsonas racism,1
23718,you might be a libtard if...,1
12705,extending your hand &amp; uniting merica is unprecedented!,1
17651,racists never ceased to rant in 2016,1
20121,comments about the obamas make him a late contender for the most loathsome character of 2016,1
13561,"coming from an ultra like surprise surprise at least they can play golf dod,",1
29136,why can't women be defenders if they want?,1
6713,"book?? wtf, that's reich?",1
3408,i wasn't aware facebook was a legislature.,1
13858,stop ating my fathers son,1
22051,"is quick to themselves over zille's comments as , but do noting about these black racists.a|",1
23955,this moron is leading the us down a path that has so much potential to damage and destroy the world. a|,1
31863,refuses to veto resolution on,1
21161,why did kick of the flight because he spoke arabic.,1
8962,all the snowpeople in this movie are white.,1
25501,sea shepherd suppoers are racist!,1
19931,sexist slant in media representation of women 'needs to change',1
19573,are a| &amp; feel like the are stomping on you? listen,1
31178,isn't it time we realized what we've done: read america's history!,1
14920,nothing would be more dangerous than to give the impression we accept,1
22363,"racial discrimination interacts with genetics, impacts health among african americans",1
8803,"carl paladino, trump ally, wishes obama dead of mad cow disease in a17",1
15191,tyler perry says backlash over his tlc show is 'reverse racism' - new york daily news,1
9073,are you &amp; feel like the are a| on you? listen,1
5919,you might be a libtard if...,1
6074,never be content to sit back and watch as others' rights are trampled upon. your rights could be next.,1
3346,i find the burka offensive because the implication that men can't control themselves on sight of an uncova|,1
30978,he isnt attracted to asian women. sends me a pic of a korean woman and says they all look the same passing it off aa|,1
21033,typical lying thats slander of a grp! dont kill 4,1
19937,reject news - my latest aicle on,1
24775,"""the reality is that the tech industry is made of regular-ass people.""",1
10945,here's being a racist troll. would love for you to spread the word,1
6193,damn she's bold,1
6021,in dd! mother after arrest; via,1
11375,reagan convinced ksa to flood the market and drive oil prices to historic lows. a|,1
6727,two bots one girl,1
1860,you might be a libtard if...,1
27054,scientists are against ! but only if the child is less than 18 months old...,1
31594,you might be a libtard if...,1
17336,sea shepherd suppoers are racist!,1
3119,check this out! i mentioned this org to you back in april. founder is a girl from nyc. happy new yeaa|,1
12707,"libtard- ""i can't believe she hate muslims and suppo trump. how can a black woman do that?"" me ""because i'm not your damn slave!""",1
31926,a follow up from the gentlemen who were kicked off of airlines for simply speaking arabic,1
25508,i've had these experiences in europe as an american. is alive and unwell.,1
1400,pay of via,1
27666,"haha wow. is a for using the n-word &amp; the equivalent of it in arabic ""abd"" which means slave:",1
28907,video men and women in bed without clothes nude mother son sex,1
3169,work out the idea of creating a substantive argument and making a point rather than calling names.a|,1
3057,and destructive socialists,1
25111,suppo these let's hope america wakes up to the plight of the,1
27516,do you hate ? loves attention. on january...,1
16847,"don't miss this: miriam herschlag's blog: haim yavin, my ass via",1
9877,allows &amp; work for your station. acceptable?,1
18747,not to sound but has her looks to fall back on unlike good luck 2 both,1
15523,a white-skinned woman's unfair experience of in india! via,1
3001,dear is &amp; lies. should never unite with leavers. have a shit christmas lady,1
2850,"disgusting racist thugs, look forward to him going back to jail",1
9103,what in the fuck is this?,1
16257,fuck donald trump! he will never be my president!,1
8604,is against a,1
1485,1 get your own house in order 2 when you returning stolen land,1
29681,not all westerners are islamophobes.,1
6323,wahhhh!!!!! white ppl arent allowed to do this!!! ddd. fuck you rich. we don't care d,1
831,does his incredibly obama impression. via,1
2653,if i'd posted your flag logo in 2008 i'd have been called . forced to bake a cake. same for dancers. elitist asses.,1
14107,i am disgusted watching defend her career &amp; intelligence to so informing the future gen is laughable? ..,1
12844,pay = pay = pay = pay = = .,1
26560,"today another attack the japanese and chinese, claims to not be racist",1
5356,i don't even know what is/isn't anymore.,1
24605,thats you,1
18952,silveragatka: had to screenshot &amp; share these snaps from michaelacoel it's an impoant message.,1
5392,typical lying thats slander of a grp! dont kill 4,1
27380,if you are pa of the 64.2 mil who rejected his business. &amp; must be stoppea|,1
18682,doesn't arrive doing a salut.but in a sharp suit,1
30831,there is only one requirement for the job of the us president: being male,1
20787,"most deaths caused by islamic extremism occur in civil wars, not terror attacks.",1
23204,cult.,1
10898,are you &amp; feel like a| are stomping on you? listen,1
10249,total asssss...worst mistake ever...lord help us all...,1
5851,"but! i'm also correct whom our enemies are, and whom to ally with; to rid ourselves of , and join together in what we have in common",1
25940,wwi &amp; wwii were both waged over oil. a|,1
23322,"last retro for you this year, and whilst i do love a good bit of i do not wanta|",1
4612,"""your people"" would have all died of scurvy their first winter if the first nations hadn't shown them a cute.a|",1
6810,council staff have been instructed by the anc to go slow and make the da look bad. this was exposed a few weeks ago.,1
25559,"for some reason, the story on snapchat seems always geared towards women.",1
14054,you might be a libtard if...,1
26319,"""his"" dad ? did you just assume gender ?",1
31272,goodbye 2016.... i definitely hope we leave behind,1
31882,come on n wake the eff up usa! this is craziness. does it all stem from n hatred of ? it seems likea|,1
9166,"hey you piece of , obama will always be more of a than you ever will",1
19396,commercial showing inter-racial couple attacked by suppoers,1
19705,stop lying about 11 years with an anti-semitic hate group,1
5644,what is your problem?,1
16603,"made , vile remarks about &amp; | and his must go",1
18950,racism at home and anti- advice for others: we're good at both.,1
5966,,1
19155,hot new release! swiftly sharpens the fang,1
3640,the lady said it's the juniors only area (it wasn't) &amp; i'd be ask to leave if someone complained. then her boss defended her,1
26110,i despise this &amp; everything he stands for! trying to destroy the usaa|,1
14565,d own team up with &amp; show what &amp; combat,1
9186,"this is awful! just slap on the face to hey my neighbor black just bought a $700,000 house. we r soa|",1
17608,"who's that ugly""lady""?",1
28286,sea shepherd suppoers are racist!,1
21155,the major kind of that people arenat talking enough about via,1
22346,fake activist !!!%####&amp;$/,1
25676,"video: on ""#america has had enough of this crap!""",1
24857,are a| &amp; feel like the are stomping on you? listen,1
3083,: police appeal following 2 alleged assaults,1
24318,you might be a libtard if...,1
6402,atk porn pics representations of women in men's alcohol ads,1
7839,this is what like... lol wtf is this? this is why you all let a get in the white house. you're all a shame.,1
5977,"please, just stop.",1
31604,dwyane wade if you hate,1
15062,must be said: voters are guilty of normalizing . which is a form of racism. morality is a not a moveable feaa|,1
16512,"holiday fun, socially relevant! celebrates '70 bewitched xmas ep",1
